{
  "$schema": "https://github.com/cyberash-dev/sdd-cli/blob/main/schema/sdd.config.schema.json",
  "spec_file": "spec/spec.md",
  "baseline_id": "fixture:BL-001",
  "discovery_scope": ["src"],
  "footprint": {
    "binding_id_prefix": "IMP-",
    "binding_field": "binding"
  },
  "mechanism": "git_tree_hash_v1"
}
